{
  "schemaVersion": 1,
  "manifestId": "123e4567-e89b-12d3-a456-426614174010",
  "kind": "knowledge",
  "channel": "experimental",
  "version": "2026.08.20.1",
  "publishedUtc": "2026-08-20T17:00:00Z",
  "source": {
    "repository": "owner/PMM",
    "commit": "0123456789abcdef0123456789abcdef01234567",
    "branch": "knowledge/experimental-bundle",
    "pullRequest": 42,
    "tag": null
  },
  "artifact": {
    "url": "https://example.invalid/knowledge.zip",
    "sha256": "7777777777777777777777777777777777777777777777777777777777777777",
    "size": 123456,
    "format": "zip"
  },
  "compatibility": {
    "pmmMin": "1.1.0",
    "pmmMax": null,
    "knowledgeSchemaMin": 2,
    "knowledgeSchemaMax": 2,
    "gameBuildMin": null,
    "gameBuildMax": null
  },
  "releaseNotes": "Example only.",
  "releaseNotesUrl": null,
  "rollback": {
    "preservePrevious": true,
    "healthCheckRequired": true
  },
  "signature": {
    "algorithm": "ed25519",
    "keyId": "pmm-release-key-1",
    "valueBase64": "AAAAAAAAAAAAAAAAAAAAAAAAAAAAAAAAAAAAAAAAAAAAAAAAAAAAAAAAAAAAAAAAAAAAAAAAAAAAAAAAAAAAAA=="
  }
}
